ocid,buyer_name,buyer_id,title,desc,supplier,value,currency,date,detected_provider
ocds-hu01ve-6935337,INSIEL SPA,00118410323,,SERVIZIO PRODUCT SUPPORT FOR LARGE ENTERPRISE SUI PRODOTTI SOFTWARE SAP E BUSINESS OBJECTS - RDA  86481- 2017,SAP ITALIA SISTEMI APPLICAZIONI PRODOTTI SPA,165700.99,EUR,2022-01-26T12:00:00Z,sap
ocds-hu01ve-6954420,UMBRIA DIGITALE S.C. A R.L.,03761180961,,RDO ALL'INTERNO DEL MEPA PER LA FORNITURA DEI SERVIZI DI SUPPORTO TECNICO PREMIER SUPPORT  ORACLE,ARSLOGICA SISTEMI S.R.L.,119879.23,EUR,2022-01-11T12:00:00Z,oracle
ocds-hu01ve-6961525,COTRAL S.P.A.,06043731006,,RINNOVO CONTRATTO DI SUPPORTO SAP,SAP ITALIA SPA,184533.0,EUR,2022-01-26T12:00:00Z,sap
ocds-hu01ve-6969353,COTRAL S.P.A.,06043731006,,PER L'AFFIDAMENTO DEL SERVIZIO IMPLEMENTAZIONE DEL MODULO SAP. ,PAABS SRL|KPMG ADVISORY,150600.0,EUR,2022-01-26T12:00:00Z,sap
ocds-hu01ve-6969907,CONINET SOCIETA PER AZIONI IN BREVE CONINET S.P.A.,08125671001,,ATTIVAZIONE ENTERPRISE AGREEMENT 4  TRIENNALE PRODOTTI MICROSOFT (RDA 5000137) ,FUJITSU TECHNOLOGY SOLUTIONS,44370.0,EUR,2022-01-12T12:00:00Z,microsoft
ocds-hu01ve-6980571,ROMA CAPITALE,02438750586,,"ADESIONE ALL'ACCORDO QUADRO 'CENTRALI TELEFONICHE 7' PER LA FORNITURA, MESSA IN OPERA E MANUTENZIONE DI CENTRALI TELEFONICHE EVOLUTE E DI PRODOTTI E SERVIZI CONNESSI  FASTWEB S.P.A.",BT ITALIA|FASTWEB SPA|VITROCISET S.P.A.|VODAFONE ITALIA S.P.A.|TELECOM ITALIA S.P.A.,3328937.74,EUR,2022-01-26T12:00:00Z,fastweb
ocds-hu01ve-7049637,REGIONE EMILIA ROMAGNA,80062590379,,SERVIZIO DI FORMAZIONE A DISTANZA CON MODALITÀ LEARNING AS A SERVICE IN CLOUD SULLE PIATTAFORME OFFICE 365 E SHAREPOINT 2016 DELLA REGIONE EMILIA ROMAGNA PER IL TRIENNIO 2018/202,4WARD SRL,210900.0,EUR,2022-02-10T12:00:00Z,microsoft
ocds-hu01ve-7063364,AGENZIA DELLE ENTRATE - RISCOSSIONE,13756881002,,ACQUISTO LICENZE SW E MANUT PER SYSTEM CENTER DI MICROSOFT NEW,TEOREMA ENGINEERING SRL,77850.0,EUR,2022-01-26T12:00:00Z,microsoft
ocds-hu01ve-7074861,LAZIO INNOVA - SOCIETA  PER AZIONI,05950941004,,"GARA A PROCEDURA APERTA PER L'AFFIDAMENTO DEI SERVIZI DI ASSISTENZA, MANUTENZIONE CORRETTIVA ED EVOLUTIVA DEL SOFTWARE GESTIONALE ERP MICROSOFT DYNAMICS NAV",AGIC TECHNOLOGY SRL ,181566.0,EUR,2022-01-26T12:00:00Z,microsoft
ocds-hu01ve-7089934,MIN LAV E PREV SOC DIREZ GEN AA GG E PERSONALE,80237250586,,"FORNITURA DI SERVIZI CLOUD, SERVIZI PROFESSIONALI, SERVIZI DI 'SUPPORTO TECNICO DEI DISPOSITIVI HARDWARE ORACLE PREMIER SUPPORT FOR SYSTEMS' E SERVIZI DI SUPPORTO ALL'INFRASTRUTTURA ORACLE HARDWARE E ",ORACLE ITALIA S.R.L.,685977.32,EUR,2022-01-26T12:00:00Z,oracle
ocds-hu01ve-7096333,COTRAL S.P.A.,06043731006,,CANONE RINNOVO LICENZE E SUPPORTO ORACLE.,ORACLE ITALIA SRL,157255.31,EUR,2022-01-26T12:00:00Z,oracle
ocds-hu01ve-7098748,AZIENDA OSPEDALIERA UNIVERSITARIA DI CATANIA,04721290874,,"RDO TRAMITE MEPA PER LA FORNITURA DI DISPOSITIVI DI SICUREZZA, MESSA IN MANUTENZIONE DEL DATA CENTER E SERVIZIO SOC A VALERE SUI PROGETTI PSN 2013 LINEA 16.4 E PSN 2015 LINEA 2.5. ",RICCA IT S.R.L. ,49533.33,EUR,2022-01-26T12:00:00Z,psn
ocds-hu01ve-7099764,ENI SPA,00484960588,,ACQUISTO E MANUTENZIONE LICENZE ORACLE,ORACLE ITALIA S.R.L.,30000000.0,EUR,2022-01-26T12:00:00Z,oracle
ocds-hu01ve-7102182,SPORT E SALUTE S.P.A.,07207761003,,INTEGRAZIONE EA4 TRUE UP AZURE - CONSIP PERIODO MAGGIO 2018 - FEBBRAIO 2020 (RDA 21391) ,FUJITSU TECHNOLOGY SOLUTIONS S.P.A.,183678.0,EUR,2022-01-10T12:00:00Z,microsoft
ocds-hu01ve-7129874,VENEZIANA ENERGIA RISORSE IDRICHE TERRITORIO AMBIENTE SERVIZI SPA,03341820276,,"BS267-18/AP SERVIZI OUTSOURCING, SYSTEM INTEGRATOR SAP E SERVIZI SUPPLEMENTARI SU PIATTAFORME DIVERSE DEL GRUPPO VERITAS",PHOENIX TECHNOLOGY SRL,5327630.0,EUR,2022-02-10T12:00:00Z,sap
ocds-hu01ve-7133148,COMUNE DI NAPOLI,80014890638,,"PROCEDURA NEGOZIATA AI SENSI DELL'ART. 192 DEL D.LGS. N. 267/2000 E DELL'ART. 36 COMMA 2 LETT. B) DEL D.LGS. N. 50/2016, MEDIANTE RDO SU MEPA, RIGUARDANTE LA 'FORNITURA E INSTALLAZIONE DI UN SISTEMA O",WESTPOLE SPA,155895.0,EUR,2022-01-26T12:00:00Z,oracle
ocds-hu01ve-7134627,RAI RADIOTELEVISIONE ITALIANA S.P.A.,06382641006,,SERVIZI DI MANUTENZIONE SOFTWARE ED HARDWARE ORACLE,DEDAGROUP SPA |TELECOM ITALIA,2304081.0,EUR,2022-01-26T12:00:00Z,oracle
ocds-hu01ve-7141082,RAI RADIOTELEVISIONE ITALIANA S.P.A.,06382641006,,FORNITURA LICENZE E SOTTOSCRIZIONI SAP,SIDI SPA,1566258.0,EUR,2022-01-26T12:00:00Z,sap
ocds-hu01ve-7142273,RETE FERROVIARIA ITALIANA - SOCIETA  PER AZIONI,01585570581,,"PROGETTAZIONE ESECUTIVA E LA REALIZZAZIONE DI UN NUOVO APPARATO CENTRALE COMPUTERIZZATO MULTISTAZIONE (ACCM) DELLA TRATTA PESCARA (E) - TERMOLI (E) DELLA LINEA BOLOGNA - BARI, COMPRENDENTI INTERVENTI ",SWS ENGINEERING SPA|ANSALDO STS|COMESVIL SPA|EREDI GIUSEPPE MERCURI S.P.A.,42643834.4,EUR,2022-01-26T12:00:00Z,oracle
ocds-hu01ve-7153615,MINISTERO INTERNO DIPARTIMENTO DELLA P.S.,80202230589,,PR.356.016.3-FORNITURA LICENZE IBM PER PROGETTO 1.1.1-ISF BORDERS-PER INFRASTRUTTURA PROGETTO I-VIS,ITALWARE SRL|TELECOM ITALIA SPA,59497.08,EUR,2022-01-26T12:00:00Z,ibm
ocds-hu01ve-7155745,AZIENDA SERVIZI IGIENE AMBIENTALE - NAPOLI S.P.A. IN FORMA ABBREV IATA A.S.I.A.-NAPOLI S.P.A.,07494740637,,"PNME003/2018-ASSISTENZA SISTEMISTICA SU PIATTAFORMA IBM POWER 8, SVILUPPO SIFTWARE E HELPDESK",INFOCHAIN DI FERNANDO D'ANIELLO,125790.0,EUR,2022-02-25T12:00:00Z,ibm
ocds-hu01ve-7156347,REGIONE TOSCANA,01386030488,,FORNITURA DI 3220 PROCESSOR VALUE UNIT (PVU) DI IBM DATA MANAGEMENT BUNDLE  ANNUAL SW SUBSCRIPTION & SUPPORT RENEWAL 12 MONTHS (E0NQGLL),,0.0,EUR,2022-01-27T12:00:00Z,ibm
ocds-hu01ve-7182038,AZIENDA SANITARIA LOCALE ROMA 6,04737811002,,"SERVIZIO OPERATIVO, ASSISTENZA E MANUTENZIONE APPLICATIVA SISTEMA ORACLE APPLICATIONS",SOPRA STERIA GROUP S.P.A.,125696.0,EUR,2022-01-26T12:00:00Z,oracle
ocds-hu01ve-7183324,AZIENDA OSPEDALIERA UNIVERSITARIA POLICLINICO PAOLO GIACCONE DI PALERMO,05841790826,,"PROCEDURA NEGOZIATA IN REGIME DI PRIVATIVA INDUSTRIALE, AI SENSI DEL D.LGS. 50/2016 E SS.MM.II., PER LA FORNITURA DI N.1 APPARECCHIATURA: DEPARRAY? NXT PLATFORM (PSN 2015 LINEA PROGETTUALE 6.2 'ONCOLO",SILICON BIOSYSTEMS SPA,144900.0,EUR,2022-01-26T12:00:00Z,psn
ocds-hu01ve-7186116,ACI INFORMATICA SOCIETA  PER AZIONI IN BREVE ACI INFORMATICA S.P.A.,00405030586,,CAMPAGA PROMO-INFORMATIVA READY2GO 2018 TRAMITE FUNZIONALITÀ DISPONIBILI SUL MOTORE DI RICERCA GOOGLE,GOOGLE IRELAND LTD,65000.0,EUR,2022-01-26T12:00:00Z,google
ocds-hu01ve-7283900,UMBRIA DIGITALE S.C. A R.L.,03761180961,,SERVIZI DI SUPPORTO ORACLE,ARSLOGICA SISTEMI S.R.L.,63000.0,EUR,2022-01-11T12:00:00Z,oracle
ocds-hu01ve-7316036,REGIONE TOSCANA,01386030488,,"FORNITURA DI (I) LICENZA D'USO DI SOFTWARE ON PREMISE, (II) SERVIZIO DI SUPPORTO E MANUTENZIONE PSLE, (III) SERVIZI CLOUD.",S.A.P. ITALIA SPA,2636898.8,EUR,2022-01-29T12:00:00Z,cloud_generic
ocds-hu01ve-7317542,AZIENDA SANITARIA LOCALE ROMA 6,04737811002,,"SERVIZIO OPERATIVO, ASSISTENZA E MANUTENZIONE APPLICATIVA SISTEMA ORACLE APPLICATIONS",SOPRA STERIA GROUP S.P.A.,62848.0,EUR,2022-01-26T12:00:00Z,oracle
ocds-hu01ve-7318635,COTRAL S.P.A.,06043731006,,CANONE RINNOVO LICENZE E SUPPORTO ORACLE ANNO 2019,ORACLE ITALIA SRL,211851.5,EUR,2022-01-26T12:00:00Z,oracle
ocds-hu01ve-7375288,AZIENDA SOCIO-SANITARIA TERRITORIALE NORD MILANO,09320420962,,"ADESIONE ALLA CONVENZIONE CONSIP  'TELEFONIA FISSA 5' PER LA FORNITURA DI  SERVIZI DI TELEFONIA FISSA IN FAVORE DELLE PUBBLICHE AMMINISTRAZIONI - ID 1601,  STIPULATA CON LA SOCIETÀ FASTWEB S.P.A.",VODAFONE ITALIA SPA|BT ITALIA S.P.A.|TISCALI ITALIA S.P.A.|FASTWEB|WIND TELECOMUNICAZIONI S.P.A.,208650.0,EUR,2022-03-08T12:00:00Z,fastweb
ocds-hu01ve-7397030,COMUNE DI MILANO,01199250158,,AFFIDAMENTO DEL SERVIZIO DI MANUTENZIONE ORACLE PREMIER SUPPORT FOR SYSTEMS COMPRENSIVO DI TUTTE LE COMPONENTI HARDWARE INSTALLATE SUI DUE SISTEMI EXADATA,ORACLE ITALIA SRL,144269.15,EUR,2022-02-10T12:00:00Z,oracle
ocds-hu01ve-7422306,BANCA D ITALIA,00997670583,,G001/19 - SOFTWARE IBM PASSPORT PER SISTEMI INTERMEDI E RELATIVA MANUTENZIONE,TELECOM ITALIA SPA|ITALWARE - S.R.L.,13277880.0,EUR,2022-03-15T12:00:00Z,ibm
ocds-hu01ve-7423742,ARPAT-AG. REG. PROT. AMBIENTALE TOSCANA,04686190481,,"ADESIONE ALLA CONVENZIONE STIPULATA DA CONSIP S.P.A. CON TELECOM ITALIA S.P.A. PER LA FORNITURA DI SERVIZI DI TELEFONIA MOBILE IN FAVORE DELLE PUBBLICHE AMMINISTRAZIONI, DENOMINATA TELEFONIA MOBILE 7 ",TELECOM ITALIA SPA,52423.17,EUR,2022-02-10T12:00:00Z,tim
ocds-hu01ve-7427558,SOGEI SPA,02327910580,,"SERVIZI DI SVILUPPO, MANUTENZIONE E SUPPORTO IN AMBIENTE ORACLE E-BUSINESS",ENGINEERING INGEGNERIA INFORMATICA S.P.A.|NTT DATA ITALIA S.P.A.|SQS ITALIA SPA|PRICEWATERHOUSECOOPERS ADVISORY SPA|ENGINEERING TRIBUTI S.P.A.|ENGINEERING ENGIWEB SECURITY S.R.L.,2072400.0,EUR,2022-03-15T12:00:00Z,oracle
ocds-hu01ve-7435175,MINISTERO SVILUPPO ECONOMICO ( MSE ),80230390587,,RICARICHE PANNELLO PARTNER ARUBA 2019,,0.0,EUR,2022-02-22T12:00:00Z,aruba
ocds-hu01ve-7438043,ISTITUTO POLIGRAFICO E ZECCA DELLO STATO SPA,00399810589,,SERVIZI DI SUPPORTO TECNICO SU TECNOLOGIA MICROSOFT PREMIER SUPPORT,MICROSOFT S.R.L.,300000.0,EUR,2022-03-22T12:00:00Z,microsoft
ocds-hu01ve-7438118,UMBRIA DIGITALE S.C. A R.L.,03761180961,,SERVIZIO DI SUPPORTO ORACLE,ATHENA SRL,195950.0,EUR,2022-01-05T12:00:00Z,oracle
ocds-hu01ve-7441643,AZIENDA PER LA TUTELA DELLA SALUTE,92005870909,,RETTIFICA E/O INTEGRAZIONE CONTRATTO PONTE TELEFONIA FISSA TF4 ASSL SASSARI. FORNITORE TELECOM ITALIA SPA.,TELECOM ITALIA S.P.A.,327868.85,EUR,2022-01-26T12:00:00Z,tim
ocds-hu01ve-7445646,MIN LAV E PREV SOC DIREZ GEN AA GG E PERSONALE,80237250586,,"FORNITURA DI SERVIZI CLOUD, SERVIZI PROFESSIONALI, SERVIZI DI 'SUPPORTO TECNICO DEI DISPOSITIVI HARDWARE ORACLE PREMIER SUPPORT FOR SYSTEMS' E SERVIZI DI SUPPORTO ALL' INFRASTRUTTURA ORACLE HARDWARE E",ORACLE ITALIA SRL A SOCIO UNICO,1312094.12,EUR,2022-02-10T12:00:00Z,oracle
ocds-hu01ve-7459444,AZIENDA PROVINCIALE PER I SERVIZI SANITARI,01429410226,,CONTRATTO BIENNALE MICROSOFT OPEN GOVERNMENT PER SERVIZI E PRODOTTI /2019,SOFTWAREONE ITALIA S.R.L.,78937.68,EUR,2022-01-23T12:00:00Z,microsoft
ocds-hu01ve-7463774,AGENZIA DELLE ENTRATE - RISCOSSIONE,13756881002,,IBM TS3500 TAPE LIBRARY EXPANSION FRAME,WESTPOLE SPA,41332.34,EUR,2022-01-26T12:00:00Z,ibm
ocds-hu01ve-7463918,AZIENDA USL DI PARMA,01874230343,,RECEPIMENTO GARA AVEN SERVIZIO DI MANUTENZIONE SOFTWARE APPLICATIVI SANITARI DI GESTIONE DITTA ENGINEERING,ENGINEERING INGEGNERIA INFORMATICA S.P.A.,661944.0,EUR,2022-03-17T12:00:00Z,engineering
ocds-hu01ve-7464174,AZIENDA ULSS N. 6 EUGANEA,00349050286,,ADEGUAMENTO APPLICATIVI ENGINEERING PER GESTIONE DEL CONSENSO (PROGETTO APRIDOC),,75000.0,EUR,2022-05-06T12:00:00Z,engineering
ocds-hu01ve-7469910,SOCIETA  REGIONALE PER LO SVILUPPO ECONOMICO DELL UMBRIA - SVILUPPUMBRIA S.P.A.,00267120541,,CREDITO SU ACCOUNT GOOGLE ADV PER CAMPAGNA SEM ,GOOGLE IRELAND LTD,220000.0,EUR,2022-01-26T12:00:00Z,google
ocds-hu01ve-7472415,RETE FERROVIARIA ITALIANA - SOCIETA  PER AZIONI,01585570581,,INTERVENTI DI ADEGUAMENTO AGLI OBBLIGHI DI LEGGE DEL FABBRICATO COD. SEDE TECNICA LO1961-OC-FA11 (EX M.M.) UBICATO NEL PIAZZALE DELLA STAZIONE DI ORVIETO.,SINTAGMA SRL|SCALA VIRGILIO & FIGLI SPA|CEPRINI COSTRUZIONI S.R.L.,165000.0,EUR,2022-02-16T12:00:00Z,oracle
ocds-hu01ve-7504814,ISTITUTO NAZIONALE DELLA PREVIDENZA SOCIALE,80078750587,,ACQUISIZIONE SERVIZIO GOOGLE MAPS PER IL CALCOLO DEI PERCORSI EFFETTUATI DAI MEDICI PER LO SVOLGIMENTO DELLE VISITE MEDICHE DI CONTROLLO (VMC),WEB GEO SERVICES,56908.0,EUR,2022-01-03T12:00:00Z,google
ocds-hu01ve-7506262,MM S.P.A.,01742310152,,SERVIZI DI MIGRAZIONE SOL R2 - SAP,VAR GROUP S.P.A.,57280.0,EUR,2022-03-31T12:00:00Z,sap
ocds-hu01ve-7512903,COMMISSARIO DELEGATO O.C.D.P.C. 558/2018,94096150274,,"PROG. 1374 - LAVORI DI MESSA IN SICUREZZA DEL MURO VERTICALE DI SPONDA DEL F. BACCHIGLIONE IN PRECARIE CONDIZIONI DI STABILITÀ, IN CORRISPONDENZA DELLA CLINICA SAN MARCO IN CONTRÀ CHIOARE IN COMUNE DI",AGOSTINI GIANPIETRO S.R.L.,148340.37,EUR,2022-01-26T12:00:00Z,oracle
ocds-hu01ve-7513877,REGIONE CALABRIA,02205340793,,"REALIZZAZIONE DI UNA PIATTAFORMA OPEN DATA REGIONE CALABRIA IN ADESIONE AL CONTRATTO QUADRO CONSIP S.P.A. SERVIZI DI CLOUD COMPUTING, DI SICUREZZA, DI REALIZZAZIONE DI PORTALI E SERVIZI ONLINE E DI CO",ALMAVIVA S.P.A.|ALMAWAVE SRL,1074910.84,EUR,2022-03-15T12:00:00Z,cloud_generic
ocds-hu01ve-7514173,LIGURIA DIGITALE S.P.A.,02994540108,,"SERVIZI DI CLOUD COMPUTING' RIF. CONVENZIONE SERVIZI DI CLOUD COMPUTING, DI SICUREZZA, DI REALIZZAZIONE DI PORTALI E SERVIZI ONLINE E DI COOPERAZIONE APPLICATIVA PER LE PUBBLICHE AMMINISTRAZIONI' ",TELECOM ITALIA S.P.A.|POSTE ITALIANE SPA|POSTECOM SPA|HP ENTERPRISE SERVICES ITALIA S.R.L.,380099.91,EUR,2022-05-15T12:00:00Z,cloud_generic
ocds-hu01ve-7515954,BANCA D ITALIA,00997670583,,ACQUISIZIONE DI LICENZE D’USO E MANUTENZIONE MICROSOFT EA,TELECOM ITALIA S.P.A.,6565968.0,EUR,2022-03-21T12:00:00Z,microsoft
ocds-hu01ve-7517148,REGIONE VENETO,80007580279,,"ACQUISIZIONE MEDIANTE RDO SU MEPA EX ART. 36, CO. 2, LETT. B), DEL D.LGS N. 50/2016 E SS.MM.II. DI SERVIZI DI CONNETTIVITÀ PER L'ACCESSO A SERVIZI CLOUD ",TELECOM ITALIA S.P.A.,185000.0,EUR,2022-05-06T12:00:00Z,cloud_generic
ocds-hu01ve-7521624,AZIENDA SOCIO SANITARIA TERRITORIALE (ASST) DELLA VALLE OLONA,03510190121,,ASSISTENZA E MANUTENZIONE SOFTWARE ORACLE E-BUSINESS SUITE PER 36 MESI CON OPZIONE DI RINNOVO PER 12 MESI,CS2 SOLUTIONS,275625.0,EUR,2022-02-21T12:00:00Z,oracle
ocds-hu01ve-7623230,POSTE ITALIANE SPA,97103880585,,"AQ SVILUPPI SU MICROSOFT COLLABORATION, COGNITIVE, IOT E BLOCKCHAIN",ENGINEERING DHUB S.P.A.|AVANADE ITALY SRL|EY ADVISORY S.P.A.|IBM ITALIA S.P.A.,864445.97,EUR,2022-01-26T12:00:00Z,microsoft
ocds-hu01ve-7788722,ISTITUTO NAZIONALE DI FISICA NUCLEARE (I.N.F.N.),84001850589,,"FORNITURA DI UN SISTEMA DI CALCOLO SCIENTIFICO E DI STORAGE PER IL POTENZIAMENTO DEL NODO CLOUD INFN (INFN CLOUD COMPUTING) DELLA E-INFRASTUCTURE ELIXIR, PROGETTO CNRBIOMICS",RICCA IT S.R.L. ,444402.55,EUR,2022-10-30 08:39:01.218T12:00:00Z,cloud_generic
ocds-hu01ve-7813343,LARIO RETI HOLDING S.P.A. IN ACRONIMO LRH S.P.A.,03119540130,,PROGETTO INTEGRAZIONE SISTEMI CON SALESFORCE,ENGINEERING INGEGNERIA INFORMATICA,215000.0,EUR,2022-07-27 18:40:27.307T12:00:00Z,salesforce
ocds-hu01ve-7820311,SOGEI SPA,02327910580,,RINNOVO LICENZE GOOGLE API E ACQUISTO NUOVE LICENZE PER DT E SOGEI - RDA 49949 - INIZIATIVA SOGEI 16/2020,NOOVLE S.R.L.,135000.0,EUR,2022-11-18 15:38:57.823T12:00:00Z,google
ocds-hu01ve-7820984,AZIENDA USL TOSCANA NORD OVEST,02198590503,,TIM SPA - MANUTENZIONI CISCO + SERVIZI PROFESSIONALI -  - RIF. DET. 447 DEL 27/03/2020 - LOTTO 2 - VALIDITÀ 01/07/2020-30/06/2023 (RIF. CECILIA CAVALLINI,TELECOM ITALIA SPA,423000.0,EUR,2022-09-05 08:06:27.184T12:00:00Z,tim
ocds-hu01ve-7821020,GEOFOR S.P.A. SOCIETA  CON SOCIO UNICO RETIAMBIENTE S.P.A.,01153330509,,RINNOVO SERVIZIO DI RIPARAZIONE SU GUASTO - ATTREZZATURE DI MARCA NORD ENGINEERING,AUTOFFICINA COPPINI DI CECCANTI DELIA,66100.0,EUR,2022-09-05 08:05:49.117T12:00:00Z,engineering
ocds-hu01ve-7821070,AZIENDA USL TOSCANA NORD OVEST,02198590503,,RTI TIM E LUTECH - MANUTENZIONI ALTRI + SERVIZI PROFESSIONALI  - RIF. DET. 447 DEL27/03/2020 - LOTTO 6 - VALIDITÀ 01/07/2020-30/06/2023 (RIF. CECILIACAVALLINI),TELECOM ITALIA SPA|LUTECH SPA,491000.0,EUR,2022-09-05 13:57:34.930T12:00:00Z,tim
ocds-hu01ve-7824089,POSTE ITALIANE SPA,97103880585,,RINNOVO MANUTENZIONE INFRASTRUTTURA STORAGE IBM,IBM ITALIA S.P.A.,958379.0,EUR,2022-09-05 08:06:49.640T12:00:00Z,ibm
ocds-hu01ve-7824286,AZIENDA USL TOSCANA NORD OVEST,02198590503,,TIM SPA - MANUTENZIONI CIBM + SERVIZI PROFESSIONALI -  - RIF. DET. 447 DEL 27/03/2020 - LOTTO 3 - VALIDITÀ 01/07/2020-30/06/2023 (RIF. CECILIA CAVALLINI,TELECOM ITALIA SPA,42429.0,EUR,2022-09-05 13:59:18.315T12:00:00Z,tim
ocds-hu01ve-7826735,HERA SPA,04245520376,,EXTENDED ECM ENABLER FOR SALESFORCE,TECHEDGE S.P.A.,55800.0,EUR,2022-09-05 13:59:13.079T12:00:00Z,salesforce
ocds-hu01ve-7827922,GESTIONE IMPIANTI E SERVIZI ECOLOGICI CASERTANI S.P.A.,03550730612,,SALA AUDIOVIDEO CONFERENCE - YEALINK VC MVC500 WIRELESS - MICROSOFT TEAMS CERTIFIED VIDEOCONFERENCE SYSTEM,,0.0,EUR,2022-09-05 13:58:12.480T12:00:00Z,microsoft
ocds-hu01ve-7839520,UNIVERSITA  DEGLI STUDI DI ROMA  LA SAPIENZA ,80209930587,,3 X LICENZE SOFTWARE ORACLE MYSQL ENTERPRISE SUBSCRIPTION (1-4 SOCKET SERVER),ARSLOGICA SISTEMI S.R.L.,9900.0,EUR,2022-10-04 16:43:18.549T12:00:00Z,oracle
ocds-hu01ve-8170103,AZIENDA SANITARIA LOCALE ROMA 6,04737811002,,"PROROGA AI SENSI DELL'ART. 106 COMMA 11, DEL CONTRATTO DI FORNITURA ORIGINARIA, AFFIDATA AL RTI AGGIUDICATARIO COMPOSTO DALLE AZIENDE FASTWEB SPA IN QUALITÀ DI MANDATARIA E MATICMIND SPA IN QUALITÀ DI",FASTWEB SPA,124461.09,EUR,2022-02-18T12:00:00Z,fastweb
ocds-hu01ve-8303671,POSTE ITALIANE SPA,97103880585,,FORNITURA N. 78 PDA E 50 LETTORI BARCODE PROGETTO TIM CALCIO,FOCELDA,79018.0,EUR,2022-01-13T12:00:00Z,tim
ocds-hu01ve-7174571,INFORMATICA ALTO ADIGE SPA,01468500218,,SERVIZI DI SUPPORTO PER SISTEMA DI BACKUP IBM DI IAA,"FASTWEB S.P.A.|FINMECCANICA SPA|IBM ITALIA S.P.A.|SISTEMI INFORMATIVI SRL, SOCIETÀ CON SOCIO UNICO. SOCIETÀ SOGGETTA A DIREZIONE E  COORDINAMENTO DI IBM ITALIA S.P.A",186421.5,EUR,2022-01-26T12:00:00Z,ibm
ocds-hu01ve-7201565,UMBRIA DIGITALE S.C. A R.L.,03761180961,,SERVIZIO DI MANUTENZIONE HARDWARE IBM,PUCCI UFFICIO,174942.45,EUR,2022-01-11T12:00:00Z,ibm
ocds-hu01ve-7319804,ROMA CAPITALE,02438750586,,"ADESIONE CONVENZIONE CONSIP SERVIZI TELEFONIA MOBILE PER LE PA LOTTO UNICO TELEFONIA MOBILE 7, AFFIDAMENTO A TELECOM ITALIA DEI SERVIZI DI TELEFONIA MOBILE E CONNESSI PREVISTI DALLA CONVENZIONE TELEFO",TELECOM ITALIA S.P.A.,147540.99,EUR,2022-02-22T12:00:00Z,tim
ocds-hu01ve-7331435,ACI INFORMATICA SOCIETA' PER AZIONI IN BREVE ACI INFORMATICA S.P.A.,00405030586,,ACQUISIZIONE DI LICENZE GOOGLE G-SUITE (BUSINESS EDITION) ,NOOVLE S.R.L.,935856.0,EUR,2022-02-10T12:00:00Z,google
ocds-hu01ve-7337216,AMMINISTRAZIONE PROVINCIALE DI PERUGIA,00443770540,,EVENTI SISMICI 2016. RIPARAZIONE  DANNO E MIGLIORAMENTO SISMICO EDIFICIO  L. MAGISTRALE  PIERALLI VIA DEL PARIONE PERUGIA OC N. 33/2017 DET A CONTRARRE. INDIZIONE PROCEDURA APERTA  'AFFIDAMENTO SERVIZ,POLITECNICA - INGEGNERIA ED ARCHITETTURA - SOCIETA COOPERATIVA|COOPROGETTI SOC COOP.VA A R.L.,396074.68,EUR,2022-01-12T12:00:00Z,oracle
ocds-hu01ve-7478793,ISTITUTO POLIGRAFICO E ZECCA DELLO STATO SPA,00399810589,,"SERVIZI DI FORMAZIONE, SUPPORTO SPECIALISTICO, FORNITURA E MANUTENZIONE DI LICENZE SOFTWARE SAP",SIDI SPA,2770339.25,EUR,2022-03-23T12:00:00Z,sap
ocds-hu01ve-7498538,ACI INFORMATICA SOCIETA' PER AZIONI IN BREVE ACI INFORMATICA S.P.A.,00405030586,,SERVIZIO DI MANUTENZIONE “ON SITE” DELLE APPARECCHIATURE HW DI TECNOLOGIA IBM,DEDAGROUP S.P.A.,692057.14,EUR,2022-06-23T12:00:00Z,ibm
ocds-hu01ve-7524343,REGIONE VENETO,80007580279,,O.C.D.P.C. N. 558/18 - OC N. 9 DEL 22.05.2019  LAVORI DI RIPRISTINO DELLE DIFESE SPONDALI E DELLA SEZIONE IDRAULICA LUNGO IL TORRENTE CREVADA IN COMUNE DI SAN PIETRO DI FELETTO E REFRONTOLO (TV) INT.N,GECOMA S.R.L.,161000.0,EUR,2022-01-26T12:00:00Z,oracle
ocds-hu01ve-7528138,REGIONE VENETO,80007580279,,LAVORI DI RIPRISTINO COPERTURE EDIFICI DEL COMPLESSO DI VILLA ZUPPANI IN PARTICOLARE LA CHIESETTA IN LOCALITÀ TRIVA A SEDICO (BL). OC 9-2019 CODICE PROVBL-113,,0.0,EUR,2022-05-12T12:00:00Z,oracle
ocds-hu01ve-7533269,ISTITUTO REGIONALE PER IL SUPPORTO ALLE POLITICHE DELLA LOMBARDIA (POLIS-LOMBARDIA),07221390961,,FORNITURA DEL SERVIZIO GSUITE FOR BUSINESS PER N.150 ACCOUNT PER UN PERIODO TRIENNALE E DI ASSISTENZA PROTEZIONE DATI,NOOVLE SRL,61913.6,EUR,2022-02-28T12:00:00Z,google
ocds-hu01ve-7713205,COMUNE DI GENOVA,00856930102,,"L'ADESIONE AL CONTRATTO QUADRO CONSIP CONSIP DEL LOTTO 4 - SERVIZI DI REALIZZAZIONE E GESTIONE DI PORTALI E SERVIZI ON-LINE , PER L'AFFIDAMENTO DEI SERVIZI CLOUD COMPUTING, DI SICUREZZA, DI REALIZZAZI",,0.0,EUR,2022-05-27 09:14:26.961T12:00:00Z,cloud_generic
ocds-hu01ve-7755283,UNIVERSITA  DEGLI STUDI DI ROMA  LA SAPIENZA ,80209930587,,SERVIZI DI SUPPORTO TECNICO ORACLE,ARSLOGICA SISTEMI S.R.L.,175098.0,EUR,2022-10-04 00:18:51.604T12:00:00Z,oracle
ocds-hu01ve-7762969,ISTITUTO NAZIONALE DELLA PREVIDENZA SOCIALE,80078750587,,                  FORNITURA DI UN 'AZURE MONETARY COMMITMENT' MICROSOFT TRAMITE CONTRATTO 'SERVER AND CLOUD ENROLLMENT (SCE)',TELECOM ITALIA S.P.A.,210910.9,EUR,2022-09-21 02:11:48.206T12:00:00Z,microsoft
ocds-hu01ve-7776139,CONSORZIO PER IL SISTEMA INFORMATIVO (CSI PIEMONTE),01995120019,,ACQUISIZIONE DI LICENZE 'PROPRIETARY APPLICATION HOSTING' DI PRODOTTI ORACLE PER L'UTILIZZO SULLA PIATTAFORMA CLOUD DEL CSI-PIEMONTE (DA20_051),ORACLE ITALIA S.R.L.,1607800.32,EUR,2022-11-10 06:06:59.511T12:00:00Z,oracle
ocds-hu01ve-7640968,ROMA CAPITALE,02438750586,,FORNITURA DI SERVIZI DI CLOUD COMPUTING - PORTALE MARCO AURELIO,POSTECOM S.P.A.|POSTEL - GRUPPO POSTE ITALIANE|POSTE ITALIANE S.P.A.|HP ENTERPRISE SERVICES ITALIA S.R.L.|TELECOM ITALIA SPA,354173.0,EUR,2022-08-28 16:56:53.778T12:00:00Z,cloud_generic
ocds-hu01ve-7641018,ROMA CAPITALE,02438750586,,AFFIDAMENTO DI SERVII DI FORNITURE DI LICENZE SAP,,0.0,EUR,2022-08-28 16:58:45.613T12:00:00Z,sap
ocds-hu01ve-7665075,DIREZIONE DI INTENDENZA - ROMA,97928840582,,"ATTIVAZIONE TIM TUO N^ 2 UTENZA (CORCIONE,RUSSO) - 5336327 ",,0.0,EUR,2022-08-28 16:56:24.608T12:00:00Z,tim
ocds-hu01ve-7694057,TERRITORIO ENERGIA AMBIENTE SPA MANTOVA,01838280202,,"SALESFORCE,LICENZE SALES & SERVICE CLOUD,CUSTOMER CUM,LIGHTNING EXT,PREMIER SUP",SALESFORCE.COM ITALY S.R.L.,1077999.0,EUR,2022-11-17 13:06:38.070T12:00:00Z,salesforce
ocds-hu01ve-7705068,EUR S.P.A.,80045870583,,SERVIZIO TECNICO MICROSOFT PREMIER SUPPORT STANDARD PER SUPPORTO EVOLUTIVO PIATTAFORMA TECNOLOGICA  VS O365 & AZURE ANNO 2020,MICROSOFT S.R.L.,50000.0,EUR,2022-10-20 16:30:04.710T12:00:00Z,microsoft
ocds-hu01ve-7751583,SOLUZIONI PER IL SISTEMA ECONOMICO SPA,05851091008,,CANONE DI MANUTENZIONE ORACLE (CONTRATTO N. 19974529) ,ORACLE ITALIA S.R.L.,63787.08,EUR,2022-11-07 21:28:49.539T12:00:00Z,oracle
ocds-hu01ve-7498715,FONDAZIONE OPERA NAZIONALE ASSISTENZA ORFANI SANITARI ITALIANI,00317040541,,ADESIONE CONVENZIONE TELEFONIA FISSA 5 FASTWEB,,0.0,EUR,2022-02-10T12:00:00Z,fastweb
ocds-hu01ve-7538257,AZIENDA UNITA SANITARIA LOCALE N. 5  SPEZZINO ,00962520110,,ADESIONE AI SERVIZI DI CLOUD COMPUTING 'SPC CLOUD LOTTO 1' CON TELECOM ITALIA S.P.A. FINO AL TERMINE DELLA CONVENZIONE PREVISTA PER IL 20/07/2021 E COMUNQUE PER UN PERIODO MASSIMO DI 24 MESI,TELECOM ITALIA SPA,48128.04,EUR,2022-02-18T12:00:00Z,tim
ocds-hu01ve-7548358,AZIENDA SANITARIA LOCALE N. 2 SAVONESE,01062990096,,ADESIONE ALLA CONVENZIONE 'MICROSOFT EA5 - FORNITURA DI LICENZE D'USO MICROSOFT ENTERPRISE AGREEMENT E DEI SERVIZI CONNESSI PER LE PUBBLICHE AMMINISTRAZIONI - LOTTO UNICO' STIPULATA DA CONSIP S.P.A. C,TELECOM ITALIA S.P.A.,1047465.9,EUR,2022-01-21T12:00:00Z,microsoft
ocds-hu01ve-7559165,AZIENDA PROVINCIALE PER I SERVIZI SANITARI,01429410226,,ADESIONE ALLACONVENZIONE 'GARA SISTEMI GESTIONALI INTEGRATI - LOTTO 4' PER IL PROGETTO DI 'IMPLEMENTAZIONEDELLA SOLUZIONE SAP NELL'AMBITO AMMINISTRATIVO/CONTABILE E LOGISTICO DI APSS'  ,,0.0,EUR,2022-02-23T12:00:00Z,sap
ocds-hu01ve-7560955,REGIONE VENETO,80007580279,,ACQUISIZIONE DEI SERVIZI DI ASSISTENZA A SUPPORTO DI LICENZE ORACLE OIM TRAMITE RDO SU PIATTAFORMA CONSIP MEPA  ,SPRING FIRM SRL,115258.7,EUR,2022-05-06T12:00:00Z,oracle
ocds-hu01ve-7561567,REGIONE VENETO,80007580279,,ACQUISIZIONE DI SERVIZI DI MANUTENZIONE DELLE LICENZE ORACLE OIM TRAMITE RDO SU PIATTAFORMA CONSIP MEPA ,SPRING FIRM SRL,135795.53,EUR,2022-05-06T12:00:00Z,oracle
ocds-hu01ve-7573472,LARIO RETI HOLDING S.P.A. IN ACRONIMO LRH S.P.A.,03119540130,,"PROCEDURA APERTA TRAMITE PIATTAFORMA TELEMATICA PER I SERVIZI DI CALL CENTER PER IL NUMERO VERDE INFORMAZIONI, NUMERO VERDE PRONTO INTERVENTO CON FUNZIONALITA' 24/7 E CENTRALINO POSTO OPERATORE - FORN",,0.0,EUR,2022-05-27T12:00:00Z,salesforce
ocds-hu01ve-7583259,REGIONE AUTONOMA DELLA SARDEGNA,80002870923,,"AM SIBAR-SIBEAR 2020-2021 - PROCEDURA NEGOZIATA SENZA PUBBLICAZIONE DEL BANDO DI GARA PER L'AFFIDAMENTO DI NUOVI SERVIZI CONSISTENTI NELLA RIPETIZIONE DI SERVIZI ANALOGHI ( EX ART. 63, COMMA 5, D.LGS ",AICOF SRL|ACCENTURE S.P.A.|ACCENTURE TECHNOLOGY SOLUTIONS - IT,5419500.0,EUR,2022-06-21T12:00:00Z,cloud_generic
ocds-hu01ve-7587825,AZIENDA ULSS N. 3 SERENISSIMA,02798850273,,BONIFICA AMIANTO PAD. GAGGIA OC VENEZIA ,EUREKA,44930.0,EUR,2022-01-26T12:00:00Z,oracle
ocds-hu01ve-7645063,SOGEI SPA,02327910580,,GARA PER LICENZE D'USO E RINNOVO DELLA MANUTENZIONE DEI PRODOTTI SOFTWARE MICROSOFT PER SOGEI - ID 2199,TELECOM ITALIA S.P.A.,60324699.6,EUR,2022-10-19 13:42:53.452T12:00:00Z,microsoft
ocds-hu01ve-7694816,AGENZIA DI TUTELA DELLA SALUTE DELLA VAL PADANA,02481970206,,ADESIONE GARA AGGREGATA (ATS MI CAPOFILA) - SERVIZIO DI MANUTENZIONE E SUPPORTO DELLE LICENZE ORACLE E-BUSINESS E ORACLE DATABASE PER UN PERIODO DI 24 MESI,ORACLE ITALIA S.R.L.,50886.34,EUR,2022-10-20 15:29:00.120T12:00:00Z,oracle
